{
  "schemaVersion":"agent-browser.p158-external-handoff-fixtures.v1",
  "planId":"P158",
  "syntheticOnly":true,
  "sessions":[
    {
      "fixtureId":"handoff-clean-public-https","description":"Clean external HTTPS handoff with all ingress checks and identity continuity.",
      "externalVantage":{"runnerId":"runner-external-a","outsideServiceHost":true,"outsideServiceNetworkNamespace":true,"publicEgressObserved":true},
      "initialHandoffId":"handoff-clean","initialHandoffUrl":"https://remote.example.test/remote-view/handoff-clean","operatorVisibleState":"ready","readyObservedAt":"2026-09-02T21:00:00.100Z","firstUsablePixelsAt":"2026-09-02T21:00:00.200Z",
      "expectedIdentity":{"browserId":"browser-clean","profileId":"profile-clean","sessionId":"session-clean","tabId":"tab-clean","targetId":"target-clean","visibleUrl":"https://synthetic.example.test/page","pageMarker":"marker-clean","pixelHash":"aaaaaaaaaaaaaaaaaaaaaaaaaaaaaaaaaaaaaaaaaaaaaaaaaaaaaaaaaaaaaaaa"},
      "urlObservations":[
        {"observationId":"clean-start","role":"starting_handoff","url":"https://remote.example.test/remote-view/handoff-clean","navigable":true,"source":"external_client"},
        {"observationId":"clean-location","role":"location_header","url":"https://remote.example.test/remote-view/handoff-clean","navigable":true,"source":"external_client"},
        {"observationId":"clean-iframe","role":"iframe_src","url":"https://remote.example.test/session/frame","navigable":true,"source":"external_client"},
        {"observationId":"clean-form","role":"form_action","url":"https://remote.example.test/session/input","navigable":true,"source":"external_client"},
        {"observationId":"clean-ws","role":"websocket_endpoint","url":"wss://remote.example.test/session/socket","navigable":true,"source":"external_client"},
        {"observationId":"clean-reconnect","role":"reconnect_target","url":"https://remote.example.test/remote-view/handoff-clean","navigable":true,"source":"external_client"},
        {"observationId":"clean-copy","role":"copied_action","url":"https://remote.example.test/remote-view/handoff-clean","navigable":true,"source":"clipboard"},
        {"observationId":"clean-error","role":"error_action","url":"https://remote.example.test/remote-view/handoff-clean","navigable":true,"source":"error_ui"}
      ],
      "ingressChecks":[
        {"checkId":"clean-dns","kind":"dns","state":"passed","targetUrl":"https://remote.example.test/","resolvedAddresses":["203.0.113.44"],"observedAt":"2026-09-02T21:00:00.010Z","detail":null},
        {"checkId":"clean-tls","kind":"tls","state":"passed","targetUrl":"https://remote.example.test/","resolvedAddresses":[],"observedAt":"2026-09-02T21:00:00.020Z","detail":null},
        {"checkId":"clean-redirect","kind":"redirect","state":"passed","targetUrl":"https://remote.example.test/remote-view/handoff-clean","resolvedAddresses":[],"observedAt":"2026-09-02T21:00:00.030Z","detail":null},
        {"checkId":"clean-cookie","kind":"cookie","state":"passed","targetUrl":"https://remote.example.test/remote-view/handoff-clean","resolvedAddresses":[],"observedAt":"2026-09-02T21:00:00.040Z","detail":null},
        {"checkId":"clean-ws-check","kind":"websocket","state":"passed","targetUrl":"wss://remote.example.test/session/socket","resolvedAddresses":[],"observedAt":"2026-09-02T21:00:00.050Z","detail":null},
        {"checkId":"clean-iframe-check","kind":"iframe","state":"passed","targetUrl":"https://remote.example.test/session/frame","resolvedAddresses":[],"observedAt":"2026-09-02T21:00:00.060Z","detail":null},
        {"checkId":"clean-form-check","kind":"form_action","state":"passed","targetUrl":"https://remote.example.test/session/input","resolvedAddresses":[],"observedAt":"2026-09-02T21:00:00.070Z","detail":null},
        {"checkId":"clean-reconnect-check","kind":"reconnect","state":"passed","targetUrl":"https://remote.example.test/remote-view/handoff-clean","resolvedAddresses":[],"observedAt":"2026-09-02T21:00:00.300Z","detail":null}
      ],
      "reconnects":[{"reconnectId":"clean-reconnect-1","handoffId":"handoff-clean","handoffUrl":"https://remote.example.test/remote-view/handoff-clean","state":"passed","operatorVisibleState":"ready","readyObservedAt":"2026-09-02T21:00:01.100Z","firstUsablePixelsAt":"2026-09-02T21:00:01.200Z","physicalBrowserLaunchCount":0,"identity":{"browserId":"browser-clean","profileId":"profile-clean","sessionId":"session-clean","tabId":"tab-clean","targetId":"target-clean","visibleUrl":"https://synthetic.example.test/page","pageMarker":"marker-clean","pixelHash":"aaaaaaaaaaaaaaaaaaaaaaaaaaaaaaaaaaaaaaaaaaaaaaaaaaaaaaaaaaaaaaaa"}}],
      "captureGaps":[],"expectedFindingCodes":[]
    },

    {"fixtureId":"handoff-external-vantage-unproven","description":"Runner shares the service network namespace.","externalVantage":{"runnerId":"runner-local","outsideServiceHost":true,"outsideServiceNetworkNamespace":false,"publicEgressObserved":false},"initialHandoffId":"handoff-vantage","initialHandoffUrl":"https://remote.example.test/remote-view/handoff-vantage","operatorVisibleState":"ready","readyObservedAt":"2026-09-02T21:01:00.100Z","firstUsablePixelsAt":"2026-09-02T21:01:00.200Z","expectedIdentity":{"browserId":"browser-vantage","profileId":"profile-vantage","sessionId":"session-vantage","tabId":"tab-vantage","targetId":"target-vantage","visibleUrl":"https://synthetic.example.test/page","pageMarker":"marker-vantage","pixelHash":"bbbbbbbbbbbbbbbbbbbbbbbbbbbbbbbbbbbbbbbbbbbbbbbbbbbbbbbbbbbbbbbb"},"urlObservations":[{"observationId":"vantage-start","role":"starting_handoff","url":"https://remote.example.test/remote-view/handoff-vantage","navigable":true,"source":"external_client"}],"ingressChecks":[],"reconnects":[],"captureGaps":[],"expectedFindingCodes":["external_vantage_unproven"]},
    {"fixtureId":"handoff-invalid-url","description":"Starting handoff is not parseable as a URL.","externalVantage":{"runnerId":"runner-external-a","outsideServiceHost":true,"outsideServiceNetworkNamespace":true,"publicEgressObserved":true},"initialHandoffId":"handoff-invalid","initialHandoffUrl":"not a url","operatorVisibleState":"ready","readyObservedAt":"2026-09-02T21:02:00.100Z","firstUsablePixelsAt":"2026-09-02T21:02:00.200Z","expectedIdentity":{"browserId":"browser-invalid","profileId":"profile-invalid","sessionId":"session-invalid","tabId":"tab-invalid","targetId":"target-invalid","visibleUrl":"https://synthetic.example.test/page","pageMarker":"marker-invalid","pixelHash":"cccccccccccccccccccccccccccccccccccccccccccccccccccccccccccccccc"},"urlObservations":[{"observationId":"invalid-start","role":"starting_handoff","url":"not a url","navigable":true,"source":"external_client"}],"ingressChecks":[],"reconnects":[],"captureGaps":[],"expectedFindingCodes":["invalid_handoff_url"]},
    {"fixtureId":"handoff-non-https","description":"Public starting handoff uses HTTP.","externalVantage":{"runnerId":"runner-external-a","outsideServiceHost":true,"outsideServiceNetworkNamespace":true,"publicEgressObserved":true},"initialHandoffId":"handoff-http","initialHandoffUrl":"http://remote.example.test/remote-view/handoff-http","operatorVisibleState":"ready","readyObservedAt":"2026-09-02T21:03:00.100Z","firstUsablePixelsAt":"2026-09-02T21:03:00.200Z","expectedIdentity":{"browserId":"browser-http","profileId":"profile-http","sessionId":"session-http","tabId":"tab-http","targetId":"target-http","visibleUrl":"https://synthetic.example.test/page","pageMarker":"marker-http","pixelHash":"dddddddddddddddddddddddddddddddddddddddddddddddddddddddddddddddd"},"urlObservations":[{"observationId":"http-start","role":"starting_handoff","url":"http://remote.example.test/remote-view/handoff-http","navigable":true,"source":"external_client"}],"ingressChecks":[],"reconnects":[],"captureGaps":[],"expectedFindingCodes":["non_https_url"]},

    {"fixtureId":"url-localhost-location","description":"Redirect Location exposes literal localhost.","externalVantage":{"runnerId":"runner-external-a","outsideServiceHost":true,"outsideServiceNetworkNamespace":true,"publicEgressObserved":true},"initialHandoffId":"handoff-url-1","initialHandoffUrl":"https://remote.example.test/remote-view/handoff-url-1","operatorVisibleState":"ready","readyObservedAt":"2026-09-02T21:04:00.100Z","firstUsablePixelsAt":"2026-09-02T21:04:00.200Z","expectedIdentity":{"browserId":"browser-url","profileId":"profile-url","sessionId":"session-url","tabId":"tab-url","targetId":"target-url","visibleUrl":"https://synthetic.example.test/page","pageMarker":"marker-url","pixelHash":"eeeeeeeeeeeeeeeeeeeeeeeeeeeeeeeeeeeeeeeeeeeeeeeeeeeeeeeeeeeeeeee"},"urlObservations":[{"observationId":"localhost-location","role":"location_header","url":"https://localhost:8443/session","navigable":true,"source":"external_client"}],"ingressChecks":[],"reconnects":[],"captureGaps":[],"expectedFindingCodes":["loopback_url_leak"]},
    {"fixtureId":"url-ipv4-loopback-copied","description":"Copied action exposes IPv4 loopback.","externalVantage":{"runnerId":"runner-external-a","outsideServiceHost":true,"outsideServiceNetworkNamespace":true,"publicEgressObserved":true},"initialHandoffId":"handoff-url-2","initialHandoffUrl":"https://remote.example.test/remote-view/handoff-url-2","operatorVisibleState":"ready","readyObservedAt":"2026-09-02T21:05:00.100Z","firstUsablePixelsAt":"2026-09-02T21:05:00.200Z","expectedIdentity":{"browserId":"browser-url","profileId":"profile-url","sessionId":"session-url","tabId":"tab-url","targetId":"target-url","visibleUrl":"https://synthetic.example.test/page","pageMarker":"marker-url","pixelHash":"eeeeeeeeeeeeeeeeeeeeeeeeeeeeeeeeeeeeeeeeeeeeeeeeeeeeeeeeeeeeeeee"},"urlObservations":[{"observationId":"ipv4-copy","role":"copied_action","url":"https://127.0.0.1:8443/session","navigable":true,"source":"clipboard"}],"ingressChecks":[],"reconnects":[],"captureGaps":[],"expectedFindingCodes":["loopback_url_leak"]},